url,publish_date,author,headline,summary,content
https://www.bbc.com/news/articles/c5ymvygpj7go,2025-02-27T08:48:28.389Z,Chris Mason,"US needs role in Ukraine to deter Putin, says PM","Sir Keir Starmer has reiterated his call for a US security guarantee in Ukraine to deter Vladimir Putin from invading again, as he prepares to meet Donald Trump.","Sir Keir Starmer has reiterated his call for a US security guarantee in Ukraine to deter Vladimir Putin from invading again, as he prepares to meet Donald Trump. Speaking on the plane to Washington DC, Sir Keir said he hoped the UK-US relationship could go from ""strength to strength"". But the two leaders appear to be at odds over the importance of US security guarantees for Ukraine as part of any peace deal there. Sir Keir said discussions about potentially sending British troops to Ukraine were ongoing but he re-emphasised his belief in the importance of a so-called US ""backstop"". Asked what form he believed this backstop should take, he said: ""Exactly what the configuration of that is, exactly what the backstop is, is obviously the subject of intense discussion but I'm not going to get ahead of myself on it, other than to say I'm very clear about what the principles are."" In contrast, Trump has said: ""I'm not going to make security guarantees beyond very much.  ""We're going to have Europe do that, because we're talking about Europe as the next door neighbour."" The president did add that the expected deal between Washington and Kyiv over access to Ukrainian minerals was ""great"" for Ukraine ""because they get us over there."" ""We will be on the land and that way there is going to be automatic security because nobody is going to be messing around with our people."" It is not yet known how much security support European leaders are asking for from America, nor is the scale of any American manpower on the ground in Ukraine associated with a minerals deal. The prime minister said: ""I'm considering how we preserve peace in Europe and how we get a lasting peace in Ukraine.  ""And I'm absolutely convinced that we need a lasting peace, not a ceasefire, and for that to happen we need security guarantees.  ""Precisely what that layers up to, what that looks like, is obviously a subject of intense discussion. We will play our part and I've been clear that we will need a US backstop of some sort. ""My concern is if there is a ceasefire without a backstop, it will simply give him [Putin] the opportunity to wait and to come again because his ambition in relation to Ukraine is pretty obvious, I think, for all to see."" Speaking at a reception at the UK Ambassador's residence in Washington on Wednesday evening, the Sir Keir told guests that he wanted to strike a ""new partnership"" with the United States, and said ""our best days lie ahead"". On domestic policy, the prime minister said that ""taking out a chainsaw isn't quite my style"" - a reference to an Elon Musk stunt at the conservative CPAC conference earlier this week - but said ""we are stripping away red tape and bureaucracy"". Lord Mandelson, the British ambassador, said Trump was a ""very consequential president"" and that ""all the freedom-loving democracies in the world"" faced a ""very significant moment"". ""The US and the United Kingdom, we basically share everything together,"" he said. ""And of course one thing we don't need to fight over is trade, because we have this fantastically fair and balanced trade relationship when we reciprocate so much - that's just a little thing for you to remember in the coming weeks."" Tariffs on steel imports to the US are set to come into force in March, with the president also considering other import taxes as part of his drive to protect American businesses. After the visit from Sir Keir, Trump will host Ukrainian President Volodymyr Zelensky. Zelensky has said the deal on minerals is preliminary and that he still wants further agreements, arguing that without security guarantees from the US ""we won't have a ceasefire, nothing will work."" Foreign Secretary David Lammy, speaking to ITV's Peston programme, sounded hopeful about a deal. ""If US interests are on the ground in Ukraine, then that is the best security guarantee that the Ukrainians can have,"" he said.  Sir Keir was notably guarded in his remarks in advance of Thursday's meetings in the White House, such are the stakes and sensitivities around Ukraine, the Middle East and trade with America since Trump's inauguration. Strengthening and deepening the US-UK relationship might be his ambition, but it is far from guaranteed with such an unpredictable president. But asked if he could trust Trump, given what he had said in recent weeks, the prime minister replied: ""Yes, I've got a good relationship with him.  ""As you know, I've met him, I've spoken to him on the phone, and this relationship between our two countries is a special relationship with a long history, forged as we fought wars together, as we traded together."" Does he think President Trump sees Russia as the aggressor in Ukraine? ""Of course, the president has been very clear about the peace that he wants - he's right about that.  ""We all want peace - the question is, how do we make sure it's a lasting peace."" ""There's no issue between us on this,"" Sir Keir insisted. Theresa May, former prime minister and Conservative peer, urged Sir Keir to tell Trump that Russia is the aggressor in Ukraine. Speaking in the House of Lords on Wednesday, she said: ""Will he impress on President Trump that...the defence of Europe benefits the defence of America, and the Ukrainians are fighting for their independence and their sovereignty - principles which should be defended by all of us who value or benefit from economic and democratic freedom."" Earlier this week, the prime minister announced the UK would boost military spending to 2.5% of national income by 2027, a move seen as an attempt to curry favour with the US president who has frequently attacked European countries for failing to spend more on defence.  The increase is being funded by a cut to the foreign aid budget which has angered international development charities and some of the prime minister's own MPs.  The UK's former security adviser Lord Sedwill told BBC Radio 4's Today programme the UK was taking the right tack in increasing defence spending and urging its European neighours to do the same. He said: ""By showing we're willing to do more on defence... to build that capability, I think we're showing that Europe will step up and that's the best way to keep the US invested, even under a Trump presidency.""  In addition to the Ukraine war, talks are also expected to take in a discussion about trade and artificial intelligence. Downing Street wants what it calls ""further integration"" between the two countries' technology sectors. The potential flashpoints for Sir Keir are numerous and considerable - it is a landmark moment in his first year as prime minister. Sign up for our Politics Essential newsletter to read top political analysis, gain insight from across the UK and stay up to speed with the big moments. It'll be delivered straight to your inbox every weekday. The US president said Venezuela had not lived up to its promises on taking back deported migrants. President Trump has repeatedly claimed that the US has given over $300bn to Ukraine, but he is incorrect. Tariffs are a central part of Trump's political vision, but economists warn they could put prices up. The decision goes against a lower court judge's ruling that the government had to pay aid contractors. The first minister is calling on civic Scotland to come together and tackle populist politics. Copyright 2025 BBC. All rights reserved.  The BBC is not responsible for the content of external sites. Read about our approach to external linking.  "
https://www.bbc.com/news/articles/ce8yy0116y8o,2025-02-27T16:06:20.591Z,Paul Burnell,MP Mike Amesbury's jail term suspended on appeal,"MP Mike Amesbury, who admitted repeatedly punching a constituent in the street, has had his 10-week prison sentence suspended following an appeal.","MP Mike Amesbury, who admitted repeatedly punching a constituent in the street, has had his 10-week prison sentence suspended following an appeal. The Runcorn and Helsby MP assaulted Paul Fellows, 45, following a row in Frodsham, Cheshire, last year and was jailed by magistrates on Monday. Amesbury, who had the Labour whip removed in October, launched an appeal and a judge said that while the length of the sentence had been ""spot on"", it should be suspended for two years. Judge Steven Everett, sitting with two magistrates at Chester Crown Court, also ordered Amesbury to carry out 200 hours of unpaid work. Amesbury must also undertake an alcohol monitoring programme, go on an anger management course, and carry out 20 days of rehabilitation work. His sentence still leaves the 55-year-old MP, who now sits as an independent, at risk of being ousted. If at least 10% of his constituents back a recall petition, a by-election will take place. Leaving court, Amesbury refused to answer questions from the waiting media about whether he would resign as an MP. But he said: ""I'd like to reiterate that I sincerely apologise once again to Mr Fellows and his family. ""I'm now going to go and see my family, and go home, and I'll give a statement at a later stage."" Video footage of the assault, which happened near a taxi rank in the early hours of 26 October, which was played in court. It showed Amesbury punching Mr Fellows in the head, knocking him to the ground. The politician then hit him at least five more times and swore at him. Amesbury was then heard saying: ""You won't threaten your MP again, will you?"" Judge Everett told Amesbury the facts showed him ""in a truly unfavourable light"" and, as an MP, he ""should be showing an example"".  While acknowledging it would be wrong to sentence him differently because he was an MP, the judge added: ""That doesn't mean we can't take into account that your behaviour as an MP was simply disgraceful."" He said he also could not ignore Amesbury's ""heavy drinking and fighting"". The former Labour politician had arrived at court in a prison van and wore handcuffs as he was led into the building. The court heard that, in a prepared statement given in a police interview, Amesbury claimed he had been approached by a man ""shouting and screaming"" about local and national matters. The MP said that, because he was terrified and the other man's ""arms were swinging"", he felt he had no option but to ""defend"" himself. But the judge told him the CCTV pictures revealed a very different story. ""In reality, you told the police a pack of lies. Nothing more, nothing less,"" he said. Judge Everett questioned why a charge of affray - which can carry a longer sentence - had not been brought by the prosecution. Daniel Travers, defending Amesbury, told the court: ""He's now had three nights in prison which is an experience he will never forget, certainly."" He said the ""public shaming"" and ""embarrassment"" had had a huge impact on his client.  ""This is a man who will certainly rehabilitate,"" said Mr Travers. ""He will learn a very painful lesson."" The confirmation of Amesbury's prison sentence, even though it has now been suspended, could still result in him being ousted from the Commons. The long-time Labour politician has been sitting as an independent MP for the last four months, following his suspension by party bosses. Under parliamentary rules, if an MP receives a custodial sentence a ""recall petition"" is triggered. After hearing from Chester Crown Court, the Speaker of the House of Commons will contact the returning officer for Amesbury's Runcorn and Helsby constituency. Constituents will then have six weeks to ask for their MP's removal by registering at 10 nominated places. If at least 10% of them vote to remove Amesbury, a by-election will be called. It would be the first by-election since Labour came to power following the July 2024 general election. Having first been elected as a Labour MP in the Cheshire constituency of Weaver Vale in 2017, Amesbury comfortably won the Runcorn and Helsby seat which was created following boundary changes. He secured 53% of the vote and  enjoyed a majority of more than 14,000. Reform UK beat the Conservatives (16%) into second place. The former Labour politician has had a 10-week prison sentence suspended following his assault conviction. How are Chester's famous walls, which have overlooked the city since Roman times, being restored? Faith, 17, says her autism assistance dog Ember is her ""best friend"" and goes everywhere with her. Police say the victim was chased into a garden in Warrington by the dog, thought to be an XL bully. A 31-year-old man and 14-year-old boy remain in custody after the missing girl was found. Copyright 2025 BBC. All rights reserved.  The BBC is not responsible for the content of external sites. Read about our approach to external linking.  "
https://www.bbc.com/news/articles/c86pp14j0dxo,2025-02-27T15:08:42.171Z,"Chloe Harcombe, Leigh Boobyer and Lee Madan","Woman, 19, dies in suspected XL bully dog attack ","A 19-year-old woman has died after she was attacked by a dog believed to be an XL bully, police have said.","A 19-year-old woman has died after she was attacked by a dog believed to be an XL bully, police have said. Two people have been arrested following the attack at about 19:00 GMT on Wednesday at a property on Cobhorn Drive, south Bristol. Officers confirmed the dog has now been put down. Initial reports suggested it may be an XL bully, but police said it was too early to confirm the breed. A man and woman, both in their 20s, are in custody after being arrested on suspicion of being in charge of a dog dangerously out of control causing injury resulting in death and possession of a prohibited breed of dog. The woman's family have been informed and are being supported by a specially trained officer, police said. A neighbour who lives close to the scene said the woman had only lived in the property a few weeks. ""She seemed a lovely girl,"" said the neighbour, who did not wish to give her name. ""I am still trying to process this. I was up all night awake trying to process this. ""I am shocked. I just can't believe it's happened and she hasn't been there that long."" Referring to the dog owner, the neighbour said: ""The moment she walked out the door I could hear her, and I ran over to her and said, 'Are you okay?' ""She couldn't talk or say a word. It was like she wasn't there because of the shock."" Speaking at a press conference on Thursday, Insp Terry Murphy, from Avon and Somerset Police, called the incident ""incredibly rare"". ""The circumstances [officers] faced were ""immensely difficult"", he said. ""Our thoughts, first and foremost, are with the family of the young woman who's tragically died as a result of yesterday evening's incident. ""A full investigation is now well under way to establish the full circumstances of the events that led to her death."" Police do not consider there to be any ongoing risk to the public, he added, but there will be increased police presence in the area over the coming days. He declined to comment on whether the woman who died lived at the address where the incident happened, or if there had been previous police contact with the household. Doreen Tovey said the incident was ""very frightening"". ""I came out my house to see what all the commotion was,"" she said. ""[There were] loads of police cars, riot van, ambulance across the road from me."" Resident Gary Steadman said he heard ""screaming"" and that the incident was heart-breaking.  He also described the dog as ""big, butch and brown and white"" in colour. The road has reopened following a closure for investigative work on Wednesday night.  Police have urged witnesses or anybody with information about the incident to contact them by calling 101. Follow BBC Bristol on Facebook, X and Instagram. Send your story ideas to us on email or via WhatsApp on 0800 313 4630. Andrei Matei stole more than £19,000 from cash machines across England, court hears. An average Band D household is expected to pay £86 more per year from April. Mamas Bristol took home the 2024 community award for their work helping families reduce child costs. Bristol City Council has agreed its annual budget, with a 4.99% increase in council tax. Ex-Bristol mayor Marvin Rees says he wants to see a ""wider range of people"" in the House of Lords. Copyright 2025 BBC. All rights reserved.  The BBC is not responsible for the content of external sites. Read about our approach to external linking.  "
https://www.bbc.com/news/articles/cx2009jgj58o,2025-02-27T15:55:29.543Z,Paul Glynn and Steven McIntosh,Eggheads star Chris Hughes dies aged 77,"Quizzer Chris Hughes, star of the popular BBC and Channel 5 series Eggheads, has died aged 77, a statement on the programme's social media accounts has said.","Quizzer Chris Hughes, star of the popular BBC and Channel 5 series Eggheads, has died aged 77, a statement on the programme's social media accounts has said. Hughes was one of several general knowledge experts who regularly appeared on the show, which saw members of the public take on the five so-called ""Eggheads"". A statement posted on the show's Facebook and X accounts on Thursday, reported by the Press Association news agency, paid tribute to an ""Eggheads great"". ""It is with immense sadness that we announce the passing of Eggheads great Chris Hughes,"" it read. ""Chris joined the show in 2003 and over the next 20 years gave us not only brilliant answers but very many laughs and happy memories."" It concluded: ""He will be hugely missed by all his Eggheads family."" Hughes was born in Middlesex and attended Enfield Grammar School. Before becoming known as one of the country's leading quizzers, he worked as a train driver and railway worker.  He went on to become a regular contributor on Eggheads - which began on BBC Two in 2003 before moving to Channel 5 in 2020.  The Eggheads panel was made up of general knowledge experts, including winners from others shows such as Mastermind, The Weakest Link and Who Wants To Be A Millionaire?. In each episode, five Eggheads would compete with a team made up of five members of the public, who would play individually against a single Egghead in each round, before a final face-off between the remaining players of both sides.  If the amateurs were successful, they would take home a cash prize. The jackpot would increase by £1,000 per episode, with each edition's prize money rolling into the next day if the Eggheads won. As a result of the Eggheads high level of expertise, many of the jackpots would reach a sizeable sum before finally being won. The highest ever jackpot reached £75,000, which was won by a team in 2007. The series was presented by news presenter Dermot Murnaghan, before Radio 2 DJ and Channel 5 talk show host Jeremy Vine took over the role. Hughes is one of only seven people to have won both Brain of Britain and Mastermind, and also scored a victory on International Mastermind. Eggheads producer Robert Dean said on X: ""[Hughes] was an amazing Egghead who considered everyone on the production team part of his family.  ""I have such fond memories of him and count myself lucky to have known him. I'll miss him tremendously."" After having reached the final of another hit quiz show, The Weakest Link, without getting a single question wrong, host Anne Robinson declared Hughes to be ""the best contestant we have had on the Weakest Link"" and chose not to use her mean spirited signature catchphrase: ""you are the Weakest Link, goodbye!"". Copyright 2025 BBC. All rights reserved.  The BBC is not responsible for the content of external sites. Read about our approach to external linking.  "
