url,publish_date,author,headline,summary,content
https://www.bbc.com/news/articles/c3d5j8ejyyro,2025-02-14T14:05:41.056Z,Unknown,Sports teams charter travel amid ferry uncertainty,A sports team in Guernsey said it has had to charter its own boat for inter-island matches because of uncertainty over ferry sailings.,"A sports team in Guernsey said it has had to charter its own boat for inter-island matches because of uncertainty over ferry sailings. It follows months of uncertainty over what schedules will be offered between Guernsey and Jersey by Danish firm DFDS and Brittany Ferries.  Sponsorship director of Guernsey Raiders RFC, Chris Gnapp, said they had taken the ""financial risk"" of chartering a boat for the rugby union team. DFDS previously said it was still finalising its schedule and it had been delayed during a legal challenge over the tender process by rival firm Brittany Ferries. The BBC has contacted both DFDS and Brittany Ferries for comment. Mr Gnapp added: ""We have had to take the financial risk of chartering this boat over because there is simply no other way of getting our training teams over to Jersey to play rugby."" Meanwhile director of Guernsey Netball, Sally Carns, said the lack of certainty about travel had been a ""logistical nightmare"".  Ms Carns said: ""We can't allow any supporters to travel because we booked out all the flights for that day. ""On the Sunday, we have had to charter a plane, which, again, the financial risk of not filling it sits with ourselves as a charity. ""Logistical nightmare is the phrase of the week."" She said questions were being asked and discussions were going to be had.  During the coming summer months, there is expected to be a third ferry service provided by Islands Unlimited, which has said it will offer a daily foot-passenger service. Chad Murray, managing director, said: ""From what we found, there is a strong desire to have consistent, regular travel between the islands."" Mr Murray said teams had been working on the new ferry service for about 18 months.  He said there was demand for services ""that allow long day trips to each of the islands, not only for tourists and visitors, but also for island communities"". Mr Murray added the current owners of the vessel it planned to use were still operating it, so they were negotiating an ""exact date"" of when it would be released.  He said it would be ""unreasonable"" to set the booking system live until they had confirmation on the date, adding he hoped it would be live in two to three weeks.  Copyright 2025 BBC. All rights reserved.  The BBC is not responsible for the content of external sites. Read about our approach to external linking.  "
https://www.bbc.com/news/articles/cd64dpepg15o,2025-02-14T13:03:29.846Z,Elliot Ball,Channel Island Dog of the Year eyes Crufts glory,The Channel Island Dog of the Year is set to go up against the best of the best at Crufts 2025.,"The Channel Island Dog of the Year is set to go up against the best of the best at Crufts 2025. Mika, a three-year-old Tibetan Terrier from Guernsey, claimed the hearts of islanders at the Trinity Royal Showground in Jersey on Saturday.  Her success now means she will be placed in the open bitch class at Crufts, regarded as the ""world's greatest dog show"" by organisers.  Mika's shared owner Chrissy Le Moignan said the category ""means she's against the big girls now, so what will be will be."" Mika has attended Crufts each year with this year's show taking place at Birmingham's NEC between 6 and 9 March.  Discussing Mika's temperament, Ms Le Moignan said: ""She loves the show ring, she's an absolute dream.  ""She's a monster outside the show ring but put her in the ring and she knows what to do. She's a real showman and she loves it."" Mika's title-winning performance on Saturday meant she was able to follow in the paw-steps of her half sister, who won the same title two years prior.  Discussing the win, Mika's other shared owner and vice president of Guernsey Kennel Club, Paige Le Moignan, said: ""I'm absolutely ecstatic, we didn't expect it at all in any way, shape or form. ""You should never go into any competition expecting to win it but everyone is there for the same reason, everyone wants to win, and we were absolutely astounded when she won.""  The Channel Island Dog of the Year award is decided over the course of 10 shows throughout the year, four in Guernsey and six in Jersey.  In order to quality for the final show, a dog must win its group. ""To get an invitation for the event is huge anyway,"" said Ms Le Moignan.   ""There was strong competition throughout, there were comments from the Jersey chairman and the judge himself that there had been really strong competition."" Follow BBC Guernsey on X and Facebook. Follow BBC Jersey on X and Facebook. Send your story ideas to channel.islands@bbc.co.uk. Copyright 2025 BBC. All rights reserved.  The BBC is not responsible for the content of external sites. Read about our approach to external linking.  "
https://www.bbc.com/news/articles/c7vd4910zeeo,2025-02-14T05:59:30.200Z,Daniel De Simone,'Where's my apology from MI5?' asks victim of abusive neo-Nazi agent,The woman at the centre of a case in which MI5 has admitted giving false evidence to three courts says she wants the service to give her a public apology.,"The woman at the centre of a case in which MI5 has admitted giving false evidence to three courts says she wants the service to give her a public apology. Beth was attacked with a machete by her former partner, a neo-Nazi misogynist who used his MI5 role to coercively control her. We revealed on Wednesday that MI5 gave false evidence to three courts over its handling of the man - a paid informant known only as agent X. MI5 has now issued an ""unreserved apology"" describing what happened as a ""serious error"" - adding it took full responsibility. But speaking for the first time since then, Beth - not her real name - asks: ""Where's my apology?"" She believes she only matters to MI5 because she is ""kicking up a fuss"" by taking a legal case against the service and ""throwing a spotlight on the way that they behave"". ""But otherwise, if I were to just go quietly away, they'd never think about me again,"" she told the BBC. Beth says she would like to see X - a foreign national - to be personally ""held accountable for all the crimes he committed"", and for there to be a review of how he was to go unpunished and start a new life abroad. Beth's legal case claims MI5 breached her human rights by failing to protect her from agent X. She is pursuing a formal complaint at an independent court, called the Investigatory Powers Tribunal (IPT). Judges ruled much of the case should be held in secret after MI5 said it does not confirm agent identities - under a principle known as neither confirm nor deny (NCND) - and had not done so with X. Secret IPT sessions would be closed to Beth and her lawyers, and therefore prevent her from knowing what MI5 says in response to her claim. ""It felt completely offensive to be told that my case would have to be held in private and that I wouldn't be privy to any of the information because that's how they operated, as if they're allowed some special licence to completely breach my human rights."" However, I revealed on Wednesday that I had been told by a senior MI5 officer that X was an agent. The disclosure happened when MI5 contacted me to try to stop a BBC story about his extremism. The IPT was one of the three courts to which MI5 gave false evidence, including by stating it had never confirmed X's agent status to me. MI5 first lied in 2022, when the government took me and the BBC to court in an attempt to block us reporting on agent X's wrongdoing - and succeeded in banning us from identifying him. Beth says the false evidence ""proves what MI5 are capable of"". ""[It] feels like all my worst suspicions have been confirmed,"" she adds. ""Everything that I was told by X about them, at the time we were together, has actually been proven to be the case - that they are unscrupulous people who will stop at nothing to achieve what they want."" Beth met agent X on a dating site. But, over time, he became physically, mentally and sexually abusive. After attacking Beth with a machete, in a case that was dropped by prosecutors after police failed to obtain the video of the attack, X left the UK while under police investigation and began work for a foreign intelligence agency. ""What concerns me so much is that, as far as we know, he is a free man,"" says Beth. ""I don't want other women to have to put up with things like this. It's disgusting."" She believes MI5 has a particular type of power that enables it to avoid transparency like other organisations. MI5 says it is conducting an internal investigation into the false evidence, which may result in disciplinary action. The senior MI5 corporate witness who gave false evidence says he thought he was telling the truth. The Home Secretary, Yvette Cooper, has also announced an independent external review of how MI5 gave false evidence. It is being conducted by Sir Jonathan Jones KC, former head of the government's legal service. Beth's case will now head back to the specialist IPT court, which will reconsider the decision to rule that MI5 can refuse to confirm that X was an agent and therefore keep evidence secret from her. Until this is decided, the full case will not be heard. When I was first in contact with Beth, she had recently suffered a breakdown because of X's behaviour towards her. She has come a long way in the years since. The legal process is re-traumatising but necessary, Beth says. ""I've already lost years of my life to X and his abuse - there seems to be no end to it. ""But it seems like it's the only way that I might, potentially, get some sort of reasonable justice."" When asked about the wider implication of her case, Beth says it is ""really important"". She says there is ""so much violence carried out on women by men,"" adding, ""whatever we can do as a society against it needs to be done"". ""I am one of the lucky ones because I've been able to speak about it and I've been listened to and so many don't get listened to."" If you have information about this story or a similar one that you would like to share with the BBC News Investigations team please get in touch. Please include a contact number if you are willing to speak to a BBC journalist. You can contact us in the following ways: Email: security.investigations@bbc.co.uk Signal:  +447811921399 Click here to learn how to use SecureDrop, an anonymous whistleblowing tool that works only in the Tor browser and follow the advice to stay secure. The London Assembly is investigating the impact of violence against women and girls on young people. Police and Crime Commissioner Matthew Scott joins Dominic King's hot seat on BBC Radio Kent.  The Court of Appeal rules Scarborough man Macauley Nesfield's original sentence was unduly lenient. The mothers of Alice Ruggles and Holly Newton meet for the first time to share their experiences. A women subject to years of abuse at the hands of her jailed partner speak of her ""constant fear"". Copyright 2025 BBC. All rights reserved.  The BBC is not responsible for the content of external sites. Read about our approach to external linking.  "
https://www.bbc.com/news/articles/c9d5wj9l8e2o,2025-02-13T12:20:37.991Z,Mark Easton,UK to deny citizenship to small boat refugees,The government has toughened up rules making it almost impossible for a refugee who arrives in the UK on a small boat to become a British citizen.,"The government has toughened up rules making it almost impossible for a refugee who arrives in the UK on a small boat to become a British citizen. New guidance states that anyone who enters the UK illegally having made a dangerous journey, which could be via boat, but also by means such as hiding in a vehicle, will normally be refused citizenship, regardless of the time that has passed.  In a statement, the Home Office said the strengthened measures made it clear that anyone who entered the UK illegally would face having a British citizenship application refused. But the change has been condemned by the Refugee Council and some Labour MPs - including Stella Creasy who said the change ""meant refugees would forever remain second class citizens"". Changes, first disclosed by the Free Movement blog, were introduced to guidance for visa and immigration staff on Monday. The changes mean that anyone deemed to have entered the country illegally - including those already here - will not be able to apply for citizenship. Described as a ""clarification"" to case worker guidance when assessing if a claimant is of ""good character', it says: ""Any person applying for citizenship from 10 February 2025, who previously entered the UK illegally will normally be refused, regardless of the time that has passed since the illegal entry took place."" Another new entry to the same guidance says: ""A person who applies for citizenship from 10 February 2025 who has previously arrived without a required valid entry clearance or electronic travel authorisation, having made a dangerous journey will normally be refused citizenship. ""A dangerous journey includes, but is not limited to, travelling by small boat or concealed in a vehicle or other conveyance."" Previously, refugees who had arrived by irregular routes would need to wait 10 years before being considered.  Under UK law, it is now an offence to enter the country without permission. This is despite the UK being signatory to international law treaties, such as the 1951 UN Refugee Convention, which state that asylum seekers and refugees should not be penalised for illegal entry.  The government's new border security bill, which scraps the Conservatives' Rwanda plan and boosts police powers against people smugglers, cleared its first vote in the House of Commons on Monday.  The Border Security, Asylum and Immigration Bill sets out Labour's plan to treat people smugglers like terrorists, and creates a new crime of endangering another person during an illegal crossing in the Channel. The Home Office also published footage of enforcement teams raiding 828 premises, including nail bars, car washes, and restaurants, as part of a UK-wide crackdown on illegal working earlier this week. Commenting on the new guidance for refugees, Labour MP Creasy said she worked with a young man who after fleeing Syria and gaining a degree is now ""contributing to our society, and has now got British citizenship"". ""This process would deny that,"" she told BBC Radio 4's Today programme. Creasy also claimed the change to rules on citizenship for refugees would ""deny"" Paddington Bear from obtaining a British passport. The fictional character famously arrived in the UK by stowing away on a boat from his home in Peru.  ""Essentially it would deny, well, frankly, Paddington,"" Creasy said. ""Paddington did the same thing. He came by an irregular route, but we gave him sanctuary but wouldn't give him a passport."" Lord Blunkett, the former Labour home secretary, urged the government to ""reflect on the societal and cohesion aspects"" of the policy. He called on ministers to consider ""the impact on children and their right to UK citizenship and the statelessness which would arrive for individuals if their birth country refused to renew or retain their nationality"". ""Surely this Parliament should have a say in such a big change,"" he told the House of Lords. In response, Home Office minister Lord Hanson of Flint said children will be ""considered sympathetically under existing legislation to date"". The Home Office confirmed that the new restrictions will ""likely not apply"" to children, ""given illegal entry is normally considered outside a child's control"". However, each citizenship application will continue to be assessed on a case-by-case basis, it added.  The Refugee Council estimates the guidance will prevent at least 71,000 refugees from obtaining British citizenship. Enver Solomon, CEO of the charity, said the government's move ""flies in the face of reason"". ""The British public want refugees who have been given safety in our country to integrate into and contribute to their new communities, so it makes no sense for the government to erect more barriers. ""We know that men women and children who are refugees want to feel part of the country that has given them a home, and support to rebuild their lives.  ""We urge ministers to urgently reconsider."" Meanwhile, immigration barrister Colin Yeo argued on social media that it is a ""clear breach of the Refugee Convention"". Although the Conservatives have yet to respond to the government's decision, Tory leader Kemi Badenoch told the BBC last week that she believes the right to citizenship and permanent residency ""should only go to those who have demonstrated a real commitment to the UK"". Badenoch spoke about her proposals to toughen up citizenship rules by making it more difficult for new immigrants to be able to permanently settle in the UK. A Home Office spokesperson said: ""There are already rules that can prevent those arriving illegally from gaining citizenship. ""This guidance further strengthens measures to make it clear that anyone who enters the UK illegally, including small boat arrivals, faces having a British citizenship application refused."" Copyright 2025 BBC. All rights reserved.  The BBC is not responsible for the content of external sites. Read about our approach to external linking.  "
https://www.bbc.com/news/articles/c4gpkgly9qzo,2025-02-13T10:23:03.051Z,George Wright,Police catch motorists doing 90mph on 30mph roads,"Almost half of UK police forces have caught motorists driving more than 90mph (144km/h) on 30mph roads in the 20 months to the end of August, the RAC says.","Almost half of UK police forces have caught motorists driving more than 90mph (144km/h) on 30mph roads in the 20 months to the end of August, the RAC says. A total of 48% of forces found drivers going more than three times the 30mph limit, while 90% had clocked people driving at 60mph. The highest recorded speed on 30mph roads was 122mph in South Yorkshire. For 20mph roads, the top speed was logged by North Wales Police at 88mph. The highest recorded speed on any road was 167mph on a 70mph stretch of the M1 in Leicestershire. The largest difference between the speed recorded and the speed limit was 161mph on a 50mph in Somerset. The data came from Freedom of Information requests the RAC made to 45 police forces relating to the period from January 2023 to the end of August 2024. Forty forces provided data. The 10 highest speeds clocked on 30mph roads were:  RAC road safety spokesperson Rod Dennis said: ""Although this data is a snapshot, it shines a light on the incredibly dangerous actions of a few, that are putting law-abiding road users at serious risk. Thankfully, the police were on hand to catch these drivers."" Chief Constable Jo Shiner, the National Police Chiefs' Council lead for roads policing, said choosing to drive above the speed limit amounted to ""reckless, selfish and completely unacceptable"" behaviour.  ""We know that some incidents of going over the speed limit can be genuine mistakes or errors, but the speeds cited here are clearly drivers taking deliberate decisions to travel at excessive speeds, putting everyone at risk,"" she said. A spokesman for the Department of Transport said there were tough penalties in place for drivers who speed.  ""While our roads are among the safest in the world, we are committed to improving road safety, and recently relaunched our Think! campaign with a focus on speeding, particularly on rural roads."" Speed is the biggest factor reported in fatal road collisions, according to government data. In 2023 speed contributed to 888 fatalities, and more than 39,000 collisions of all severities. More than 24,000 vehicles were caught on camera being driven at more than 100mph (161km/h) between 2019 and 2023, police data shows. Historic vehicle enthusiasts have marked 100 years since the launch of the Bristol to London route. Motorists could face charges of up to £160 for some offences after the mayor signed off a proposal. The events aim to help young petrolheads make friends and enjoy car culture safely. Swindon Borough Council says it will investigate how joy-riders are gaining access to the car park at night. Private plates are increasingly being seen as an investment, often never even being used on a car, say experts. Copyright 2025 BBC. All rights reserved.  The BBC is not responsible for the content of external sites. Read about our approach to external linking.  "
